{
  "song_id": "MUS-S-0010",
  "title": "你的信实广大（Great Is Thy Faithfulness）",
  "author": "Thomas O. Chisholm",
  "composer": "William M. Runyan（FAITHFULNESS）",
  "source": "词：Thomas O. Chisholm，1923；曲：William M. Runyan（FAITHFULNESS），1923。公版赞美诗学通行记载；1923 年作品的法律状态未判定。",
  "language": "zh-Hans",
  "original_or_translation": "translation",
  "era": "1923",
  "copyright": {
    "copyright_status": "unknown",
    "source": "词：Thomas O. Chisholm，1923；曲：William M. Runyan，1923。",
    "license": null,
    "usage_permission": null,
    "attribution": "Thomas O. Chisholm（词）；William M. Runyan（曲）",
    "audio_availability": "none",
    "lyrics_availability": "none",
    "permission_evidence": null
  },
  "lyrics": {
    "text": null,
    "excerpt": null,
    "note": "本记录不托管任何歌词文本。公版英文原文本身无版权问题，但常见中文译本译文各有版权方，且中文译词版本尚未核验。1923 年作品在不同法域的法律状态不一致，本记录不作判定。"
  },
  "media": {
    "audio": null,
    "score": null,
    "chord": null
  },
  "bible": {
    "core_passage": "耶哀3:22–23",
    "bible_reference_ids": [
      "BB-LAM-3-22"
    ],
    "bible_themes": [
      "信实",
      "慈爱",
      "每早晨都是新的"
    ]
  },
  "theology": {
    "theology": [
      "神论-信实与慈爱"
    ],
    "christology": [],
    "soteriology": [
      "神的信实托住救恩"
    ],
    "ecclesiology": [],
    "missiology": []
  },
  "discipleship": {
    "stage": null,
    "main_theme": "TH-04",
    "secondary_themes": [],
    "music_unit_ids": [],
    "music_unit_refs": [
      "MM04"
    ],
    "function": null,
    "age_group": [
      "成人",
      "跨代"
    ],
    "context": [
      "CTX-SUN",
      "CTX-GRP"
    ],
    "difficulty": 2
  },
  "formation": {
    "primary_function": "TR",
    "emotion": [],
    "memory": [],
    "community": [],
    "practice": [],
    "prayer": [],
    "transmission": []
  },
  "eight_dimensions": {
    "biblical_truth": {
      "score": null,
      "note": "库级未辨识：无周次上下文与已核验文本，按缺失输入一律停止处理。",
      "reviewed_by": null,
      "reviewed_at": null
    },
    "theological_formation": {
      "score": null,
      "note": "库级未辨识：无周次上下文与已核验文本，按缺失输入一律停止处理。",
      "reviewed_by": null,
      "reviewed_at": null
    },
    "emotional_formation": {
      "score": null,
      "note": "库级未辨识：无周次上下文与已核验文本，按缺失输入一律停止处理。",
      "reviewed_by": null,
      "reviewed_at": null
    },
    "community": {
      "score": null,
      "note": "库级未辨识：无周次上下文与已核验文本，按缺失输入一律停止处理。",
      "reviewed_by": null,
      "reviewed_at": null
    },
    "congregational_participation": {
      "score": null,
      "note": "库级未辨识：无周次上下文与已核验文本，按缺失输入一律停止处理。",
      "reviewed_by": null,
      "reviewed_at": null
    },
    "generational_transmission": {
      "score": null,
      "note": "库级未辨识：无周次上下文与已核验文本，按缺失输入一律停止处理。",
      "reviewed_by": null,
      "reviewed_at": null
    },
    "life_practice": {
      "score": null,
      "note": "库级未辨识：无周次上下文与已核验文本，按缺失输入一律停止处理。",
      "reviewed_by": null,
      "reviewed_at": null
    },
    "mission_orientation": {
      "score": null,
      "note": "库级未辨识：无周次上下文与已核验文本，按缺失输入一律停止处理。",
      "reviewed_by": null,
      "reviewed_at": null
    }
  },
  "tier": "C",
  "theological_note": "本记录只完成歌基层身份与经文锚点认定（2026-09-21 人工授权口径）。八维辨识、Song_Relation、S6/S7 与使用决定仍待周次上下文与人工审核；中文译词与乐谱版本未核验，法律状态未判定。",
  "review_status": "draft",
  "scenes": [
    "主日",
    "小组",
    "家庭",
    "跨代"
  ],
  "search_keywords": [
    "你的信实广大",
    "Great Is Thy Faithfulness",
    "信实",
    "慈爱",
    "每早晨都是新的"
  ],
  "version": "MUS-V-0.5.0",
  "created_at": "2026-09-21T17:12:00+08:00",
  "updated_at": "2026-09-21T17:12:00+08:00",
  "updated_by": "mos-music-library-promotion"
}
