{
  "song_id": "MUS-S-0002",
  "title": "我灵镇静（Be Still, My Soul）",
  "author": "Katharina von Schlegel",
  "composer": "Katharina von Schlegel",
  "source": "北欧圣诗传统；公版",
  "language": "zh-Hans",
  "original_or_translation": "translation",
  "era": "1752（词）/ 1899（曲）",
  "copyright": {
    "copyright_status": "public_domain",
    "source": "北欧圣诗传统；公版",
    "license": "Public Domain",
    "usage_permission": "词曲已进入公有领域；本仓所用中文译本译文未随本仓托管。",
    "attribution": "Katharina von Schlegel（词曲）",
    "audio_availability": "none",
    "lyrics_availability": "none",
    "permission_evidence": null
  },
  "lyrics": {
    "text": null,
    "excerpt": null,
    "note": "公版原文无版权问题；中文译本译文不托管。"
  },
  "media": {
    "audio": null,
    "score": null,
    "chord": null
  },
  "bible": {
    "core_passage": "诗46:10",
    "bible_reference_ids": [
      "BB-PSA-46"
    ],
    "bible_themes": [
      "神的掌权",
      "信靠",
      "盼望"
    ]
  },
  "theology": {
    "theology": [
      "神论-主权",
      "末世论-盼望"
    ],
    "christology": [],
    "soteriology": [],
    "ecclesiology": [],
    "missiology": []
  },
  "discipleship": {
    "stage": null,
    "main_theme": "TH-04",
    "secondary_themes": [],
    "music_unit_ids": [],
    "music_unit_refs": [
      "MM04"
    ],
    "function": null,
    "age_group": [
      "成人",
      "跨代"
    ],
    "context": [
      "CTX-SUN",
      "CTX-GRP",
      "CTX-FAM"
    ],
    "difficulty": 3
  },
  "formation": {
    "primary_function": "EM",
    "emotion": [
      "信靠",
      "忍耐",
      "盼望"
    ],
    "memory": [
      "「施恩的主权在神手里，不在我的掌控里」"
    ],
    "community": [],
    "practice": [],
    "prayer": [
      "在失控处境中把结局交托"
    ],
    "transmission": []
  },
  "eight_dimensions": {
    "biblical_truth": {
      "score": 4,
      "note": "「神是掌权的主，风暴终必止息」符合诗46与福音书平息风浪的脉络；但对「恩典主权不受人的边界限制」（路4:22–30）是间接呼应而非直译。",
      "reviewed_by": null,
      "reviewed_at": null
    },
    "theological_formation": {
      "score": 4,
      "note": "把「谁作主」的问题从人手里交还给神，正对 W02 的「先给我们」心态。",
      "reviewed_by": null,
      "reviewed_at": null
    },
    "emotional_formation": {
      "score": 5,
      "note": "形成信靠与忍耐，特别针对失控焦虑；这是 LQ04 的情感方向。",
      "reviewed_by": null,
      "reviewed_at": null
    },
    "community": {
      "score": 3,
      "note": "更适合个人与小组默祷式同唱，大场面会众参与度中等。",
      "reviewed_by": null,
      "reviewed_at": null
    },
    "congregational_participation": {
      "score": 3,
      "note": "旋律悠长，需要一定教唱成本。",
      "reviewed_by": null,
      "reviewed_at": null
    },
    "generational_transmission": {
      "score": 2,
      "note": "对儿童偏难；跨代传递弱。",
      "reviewed_by": null,
      "reviewed_at": null
    },
    "life_practice": {
      "score": 3,
      "note": "能支撑「交托一个具体失控之事」的实践，需单元指令配合。",
      "reviewed_by": null,
      "reviewed_at": null
    },
    "mission_orientation": {
      "score": 2,
      "note": "使命指向弱。",
      "reviewed_by": null,
      "reviewed_at": null
    }
  },
  "tier": "B",
  "review_status": "under_review",
  "theological_note": "本歌不是任何经文的直译或逐节对应，而是作为面对失控、不确定和神主权时的信靠与安静之情感回应（Theme_Response）。保持 Under Review，不得升级为 Core；使用时必须由单元 S6 指令补足「恩典突破边界」的行动维度，不得让安静取代接纳。最终适配仍需真实教会使用反馈。",
  "scenes": [
    "主日",
    "小组",
    "家庭",
    "跨代"
  ],
  "search_keywords": [
    "信靠",
    "我灵镇静",
    "Be Still My Soul",
    "掌权",
    "交托"
  ],
  "version": "MUS-V-0.3.0",
  "created_at": "2026-09-21T12:00:00+08:00",
  "updated_at": "2026-09-21T13:30:00+08:00",
  "updated_by": "mos-music-phase2a1"
}
